{
  "schema_version": "oep.reconstruction_packet.v0",
  "packet_id": "recon_code_review_agent_0001",
  "created_at": "2026-05-04T00:00:02Z",
  "scenario": "code-review-agent",
  "release_manifest_id": "rmf_code_review_agent_2026_05_04_v0",
  "trace_id": "11111111111111111111111111111111",
  "event_id": "evt_code_review_agent_step_0001",
  "tool_call_id": "tool_read_diff_0001",
  "permission_packet_id": "pder_code_review_read_diff_0001",
  "eval_id": "eval_code_review_agent_smoke_0001",
  "replay_handle": "replay_code_review_agent_0001",
  "reconstruction_status": "ready",
  "join_order": [
    {
      "step": 1,
      "artifact": "release manifest",
      "ref": "manifest/examples/code_review_agent_release.v0.json",
      "status": "present"
    },
    {
      "step": 2,
      "artifact": "agent-step event",
      "ref": "events/examples/code_review_agent_step.v0.json",
      "status": "present"
    },
    {
      "step": 3,
      "artifact": "OPA-backed permission packet",
      "ref": "permissions/examples/code_review_tool_permission.v0.json",
      "status": "present"
    },
    {
      "step": 4,
      "artifact": "operational trace bundle",
      "ref": "traces/examples/code_review_agent_trace.v0.json",
      "status": "ready"
    },
    {
      "step": 5,
      "artifact": "SQLite replay state",
      "ref": "demo/state/code_review_agent.sqlite#events/evt_code_review_agent_step_0001",
      "status": "ready"
    },
    {
      "step": 6,
      "artifact": "deterministic eval result",
      "ref": "traces/examples/code_review_agent_eval.v0.json",
      "status": "passed"
    }
  ],
  "evidence_summary": {
    "manifest": {
      "status": "present",
      "ref": "manifest/examples/code_review_agent_release.v0.json"
    },
    "event": {
      "status": "present",
      "ref": "events/examples/code_review_agent_step.v0.json"
    },
    "permission": {
      "status": "present",
      "ref": "permissions/examples/code_review_tool_permission.v0.json"
    },
    "trace": {
      "status": "ready",
      "ref": "traces/examples/code_review_agent_trace.v0.json"
    },
    "replay_state": {
      "status": "ready",
      "ref": "demo/state/code_review_agent.sqlite"
    },
    "eval": {
      "status": "passed",
      "ref": "traces/examples/code_review_agent_eval.v0.json"
    }
  },
  "replay_summary": {
    "state_ref": "demo/state/code_review_agent.sqlite#events/evt_code_review_agent_step_0001",
    "deterministic": true,
    "finding_count": 1
  },
  "eval_summary": {
    "status": "passed",
    "expected_findings": 1,
    "actual_findings": 1,
    "blocking_evidence_loss_count": 0
  },
  "open_limitations": [
    "Synthetic single-step demo only; no production incident corpus.",
    "SQLite state is generated locally by make verify and is not committed.",
    "The eval is a deterministic smoke check, not a benchmark or safety certification."
  ],
  "claim_boundary": "This packet is an inspectable reconstruction view over a synthetic reference demo. It is not an incident standard, audit report, compliance proof, production postmortem, or guarantee that the same evidence is sufficient in another system."
}

